{
  "schema_version": 1,
  "source": {
    "revision": "5418ce6b6d45ed69167b0aad53f2f595e5bc8de9",
    "synthetic": true
  },
  "route": {
    "id": "POST /api/user/auth/refresh",
    "middleware": [
      "RouteTag(api)",
      "gzip",
      "BodyStorageCleanup",
      "GlobalAPIRateLimit",
      "SessionCookieOriginGuard",
      "CriticalRateLimit",
      "DisableCache"
    ],
    "side_effects": [
      "expired refresh cookie",
      "critical rate-limit counter"
    ]
  },
  "request": {
    "method": "POST",
    "path": "/api/user/auth/refresh",
    "headers": {
      "accept": "application/json",
      "content-type": "application/json"
    },
    "body": {}
  },
  "response": {
    "status": 401,
    "selected_headers": {
      "cache-control": "no-store",
      "content-type": "application/json; charset=utf-8",
      "expires": "0",
      "pragma": "no-cache",
      "set-cookie": "new_api_refresh=; Path=/api/user/auth; Expires=Thu, 01 Jan 1970 00:00:01 GMT; Max-Age=0; HttpOnly; SameSite=Strict",
      "x-new-api-version": "v0.0.0",
      "x-oneapi-request-id": "<REQUEST_ID>"
    },
    "body": {
      "code": "AUTH_UNAUTHORIZED",
      "message": "Unauthorized",
      "success": false
    },
    "sse_frames": []
  },
  "effects": {
    "database": {
      "inserted": [],
      "updated": [],
      "deleted": []
    },
    "valkey": {
      "added": [
        {
          "key": "rateLimit:v2:ip:CT:::1",
          "digest": "56b16123fa189e87561d2aa878d570c680e2c9545676295c7a383d5c7d5b5dba"
        }
      ],
      "changed": [],
      "removed": []
    }
  },
  "normalization": {
    "rules": [
      {
        "path": "$.response.selected_headers.x-oneapi-request-id",
        "operation": "replace",
        "replacement": "<REQUEST_ID>",
        "reason": "legacy request ids contain wall-clock time and randomness"
      }
    ]
  }
}
