{
  "schema_version": 1,
  "source": {"revision": "5418ce6b6d45ed69167b0aad53f2f595e5bc8de9", "synthetic": true},
  "route": {"id": "GET /mj/image/:id (unknown)", "middleware": [], "side_effects": ["reads Midjourney by mj_id"]},
  "request": {"method": "GET", "path": "/mj/image/missing-stub-job", "headers": {"accept": "image/*"}, "body": null},
  "response": {"status": 400, "selected_headers": {"content-type": "application/json; charset=utf-8"}, "body": {"error": "midjourney_task_not_found"}, "sse_frames": []},
  "effects": {"database": {"inserted": [], "updated": [], "deleted": []}, "valkey": {"added": [], "changed": [], "removed": []}},
  "normalization": {"rules": []}
}
