{
  "schema_version": 1,
  "source": {
    "revision": "5418ce6b6d45ed69167b0aad53f2f595e5bc8de9",
    "synthetic": true
  },
  "route": {
    "id": "POST /v1/chat/completions",
    "middleware": [
      "CORS",
      "DecompressRequest",
      "BodyStorageCleanup",
      "Stats",
      "RouteTag(relay)",
      "SystemPerformanceCheck",
      "TokenAuth",
      "ModelRequestRateLimit",
      "Distribute"
    ],
    "side_effects": []
  },
  "request": {
    "method": "POST",
    "path": "/v1/chat/completions",
    "headers": {
      "accept": "application/json",
      "content-type": "application/json"
    },
    "body": {
      "model": "oracle-model",
      "messages": [
        {
          "role": "user",
          "content": "hello"
        }
      ]
    }
  },
  "response": {
    "status": 401,
    "selected_headers": {
      "content-type": "application/json; charset=utf-8",
      "x-new-api-version": "v0.0.0",
      "x-oneapi-request-id": "<REQUEST_ID>"
    },
    "body": {
      "error": {
        "code": "",
        "message": "Invalid token (request id: <REQUEST_ID>)",
        "type": "new_api_error"
      }
    },
    "sse_frames": []
  },
  "effects": {
    "database": {
      "inserted": [],
      "updated": [],
      "deleted": []
    },
    "valkey": {
      "added": [],
      "changed": [],
      "removed": []
    }
  },
  "normalization": {
    "rules": [
      {
        "path": "$.response.selected_headers.x-oneapi-request-id",
        "operation": "replace",
        "replacement": "<REQUEST_ID>",
        "reason": "legacy request ids contain wall-clock time and randomness"
      },
      {
        "path": "$.response.body.error.message",
        "operation": "regex_replace",
        "pattern": "request id: [^)]+",
        "replacement": "request id: <REQUEST_ID>",
        "reason": "relay errors embed the generated request id"
      }
    ]
  }
}
