{
  "schema_version": 1,
  "source": {
    "revision": "5418ce6b6d45ed69167b0aad53f2f595e5bc8de9",
    "synthetic": true
  },
  "route": {
    "id": "GET /api/status",
    "middleware": [
      "RouteTag(api)",
      "gzip",
      "BodyStorageCleanup",
      "GlobalAPIRateLimit"
    ],
    "side_effects": []
  },
  "request": {
    "method": "GET",
    "path": "/api/status",
    "headers": {
      "accept": "application/json"
    },
    "body": null
  },
  "response": {
    "status": 200,
    "selected_headers": {
      "content-type": "application/json; charset=utf-8",
      "x-new-api-version": "v0.0.0",
      "x-oneapi-request-id": "<REQUEST_ID>"
    },
    "body": {
      "data": {
        "HeaderNavModules": "",
        "SidebarModulesAdmin": "",
        "announcements": [],
        "announcements_enabled": true,
        "api_info": [],
        "api_info_enabled": true,
        "chats": [
          {
            "Cherry Studio": "cherrystudio://providers/api-keys?v=1&data={cherryConfig}"
          },
          {
            "AionUI": "aionui://provider/add?v=1&data={aionuiConfig}"
          },
          {
            "流畅阅读": "fluentread"
          },
          {
            "CC Switch": "ccswitch"
          },
          {
            "DeepChat": "deepchat://provider/install?v=1&data={deepchatConfig}"
          },
          {
            "Lobe Chat 官方示例": "https://chat-preview.lobehub.com/?settings={\"keyVaults\":{\"openai\":{\"apiKey\":\"{key}\",\"baseURL\":\"{address}/v1\"}}}"
          },
          {
            "AI as Workspace": "https://aiaw.app/set-provider?provider={\"type\":\"openai\",\"settings\":{\"apiKey\":\"{key}\",\"baseURL\":\"{address}/v1\",\"compatibility\":\"strict\"}}"
          },
          {
            "AMA 问天": "ama://set-api-key?server={address}&key={key}"
          },
          {
            "OpenCat": "opencat://team/join?domain={address}&token={key}"
          }
        ],
        "checkin_enabled": false,
        "custom_currency_exchange_rate": 1,
        "custom_currency_symbol": "¤",
        "data_export_default_time": "hour",
        "default_collapse_sidebar": false,
        "default_use_auto_group": false,
        "demo_site_enabled": false,
        "discord_client_id": "",
        "discord_oauth": false,
        "display_in_currency": true,
        "docs_link": "https://docs.newapi.pro/en/docs",
        "email_verification": false,
        "enable_batch_update": false,
        "enable_data_export": true,
        "enable_drawing": true,
        "enable_task": true,
        "faq": [],
        "faq_enabled": true,
        "footer_html": "",
        "github_client_id": "",
        "github_oauth": false,
        "linuxdo_client_id": "",
        "linuxdo_minimum_trust_level": 0,
        "linuxdo_oauth": false,
        "logo": "",
        "mj_notify_enabled": false,
        "oidc_authorization_endpoint": "",
        "oidc_client_id": "",
        "oidc_display_name": "OIDC",
        "oidc_enabled": false,
        "passkey_allow_insecure": false,
        "passkey_attachment": "",
        "passkey_display_name": "LMM API",
        "passkey_login": false,
        "passkey_origins": "http://localhost:3000",
        "passkey_rp_id": "localhost:3000",
        "passkey_user_verification": "preferred",
        "password_login_enabled": true,
        "password_register_enabled": true,
        "price": 7.3,
        "privacy_policy_enabled": false,
        "quota_display_type": "USD",
        "quota_per_unit": 500000,
        "register_enabled": true,
        "self_use_mode_enabled": false,
        "server_address": "http://localhost:3000",
        "setup": false,
        "start_time": "<START_TIME>",
        "stripe_unit_price": 8,
        "system_name": "LMM API",
        "telegram_bot_name": "",
        "telegram_oauth": false,
        "theme": "default",
        "turnstile_check": false,
        "turnstile_site_key": "",
        "uptime_kuma_enabled": true,
        "usd_exchange_rate": 7.3,
        "user_agreement_enabled": false,
        "version": "v0.0.0",
        "wechat_login": false,
        "wechat_qrcode": ""
      },
      "message": "",
      "success": true
    },
    "sse_frames": []
  },
  "effects": {
    "database": {
      "inserted": [],
      "updated": [],
      "deleted": []
    },
    "valkey": {
      "added": [],
      "changed": [],
      "removed": []
    }
  },
  "normalization": {
    "rules": [
      {
        "path": "$.response.selected_headers.x-oneapi-request-id",
        "operation": "replace",
        "replacement": "<REQUEST_ID>",
        "reason": "legacy request ids contain wall-clock time and randomness"
      },
      {
        "path": "$.response.body.data.start_time",
        "operation": "replace",
        "replacement": "<START_TIME>",
        "reason": "process start time is runtime-specific"
      }
    ]
  }
}
