{
  "schema_version": 1,
  "source": {"revision": "5418ce6b6d45ed69167b0aad53f2f595e5bc8de9", "synthetic": true},
  "route": {"id": "GET /mj/image/:id (isolated listener performance preemption)", "middleware": ["RouteTag(relay)", "SystemPerformanceCheck"], "side_effects": []},
  "request": {"method": "GET", "path": "/mj/image/missing-stub-job", "headers": {"accept": "image/*"}, "body": null},
  "response": {"status": 503, "selected_headers": {"content-type": "application/json; charset=utf-8", "x-new-api-version": "v0.0.0", "x-oneapi-request-id": "<REQUEST_ID>"}, "body": {"error": {"message": "system cpu overloaded (current: <CPU>%, threshold: 90%)", "type": "new_api_error", "param": "", "code": "system_cpu_overloaded"}}, "sse_frames": []},
  "effects": {"database": {"inserted": [], "updated": [], "deleted": []}, "valkey": {"added": [], "changed": [], "removed": []}},
  "normalization": {"rules": [{"path": "$.response.selected_headers.x-oneapi-request-id", "operation": "replace", "replacement": "<REQUEST_ID>", "reason": "request id is generated per request"}, {"path": "$.response.body.error.message", "operation": "regex_replace", "pattern": "current: [0-9.]+%", "replacement": "current: <CPU>%", "reason": "host CPU sample is dynamic"}]}
}
