{
  "schema_version": 1,
  "source": {
    "revision": "5418ce6b6d45ed69167b0aad53f2f595e5bc8de9",
    "synthetic": true
  },
  "route": {
    "id": "GET /v1/models",
    "middleware": [
      "CORS",
      "DecompressRequest",
      "BodyStorageCleanup",
      "Stats",
      "RouteTag(relay)",
      "TokenAuth"
    ],
    "side_effects": []
  },
  "request": {
    "method": "GET",
    "path": "/v1/models",
    "headers": {
      "accept": "application/json",
      "authorization": "Bearer sk-oraclemodelstoken"
    },
    "body": null
  },
  "response": {
    "status": 200,
    "selected_headers": {
      "content-type": "application/json; charset=utf-8",
      "x-new-api-version": "v0.0.0",
      "x-oneapi-request-id": "<REQUEST_ID>"
    },
    "body": {
      "data": [
        {
          "id": "gpt-4o",
          "object": "model",
          "created": 1626777600,
          "owned_by": "openai",
          "supported_endpoint_types": []
        },
        {
          "id": "text-embedding-3-small",
          "object": "model",
          "created": 1626777600,
          "owned_by": "openai",
          "supported_endpoint_types": []
        }
      ],
      "object": "list",
      "success": true
    },
    "sse_frames": []
  },
  "effects": {
    "database": {
      "inserted": [],
      "updated": [],
      "deleted": []
    },
    "valkey": {
      "added": [
        {
          "key": "auth:user:version:42",
          "digest": "56b16123fa189e87561d2aa878d570c680e2c9545676295c7a383d5c7d5b5dba"
        },
        {
          "key": "token:222108f11f8a4f1616245a25c0f3e76bc972a08c37b0da743036112d1ab41c1b",
          "digest": "64afbcfddc8fe5d24469bbc9e0a8677c3c646a5aed95f85a3a49166cf269c624"
        },
        {
          "key": "user:42",
          "digest": "1c1ad6fab0bec23d0ad1f93534a392ae132c23f083110193f7224d93c1f61411"
        }
      ],
      "changed": [],
      "removed": []
    }
  },
  "normalization": {
    "rules": [
      {
        "path": "$.response.selected_headers.x-oneapi-request-id",
        "operation": "replace",
        "replacement": "<REQUEST_ID>",
        "reason": "legacy request ids contain wall-clock time and randomness"
      }
    ]
  }
}
