{
  "schema_version": 1,
  "source": {"revision": "5418ce6b6d45ed69167b0aad53f2f595e5bc8de9", "synthetic": true},
  "route": {"id": "GET /api/notice", "middleware": ["RouteTag(api)", "gzip", "BodyStorageCleanup", "GlobalAPIRateLimit"], "side_effects": []},
  "request": {"method": "GET", "path": "/api/notice", "headers": {"accept": "application/json"}, "body": null},
  "response": {"status": 200, "selected_headers": {"content-type": "application/json; charset=utf-8", "x-new-api-version": "v0.0.0", "x-oneapi-request-id": "<REQUEST_ID>"}, "body": {"success": true, "message": "", "data": ""}, "sse_frames": []},
  "effects": {"database": {"inserted": [], "updated": [], "deleted": []}, "valkey": {"added": [], "changed": [], "removed": []}},
  "normalization": {"rules": [{"path": "$.response.selected_headers.x-oneapi-request-id", "operation": "replace", "replacement": "<REQUEST_ID>", "reason": "legacy request ids contain wall-clock time and randomness"}]}
}
